hadis;anjuran;larangan;informasi;kitab
Wahai Banu Najar, juallah kepadaku berapa harga (kebun kalian) . Mereka menjawab: Kami tidak menjualnya kecuali kepada Allah. Maka Beliau memerintahkan quburan-quburan Kaum Musyrikin agar digali lalu bangunan-bangunannya dihancurkan kemudian diratakan dengan tanah dan memerintahkan pula agar pohon-pohon kurma ditebang lalu batang pepohonan itu dipasang bersusun untuk arah qiblat masjid.;1;0;0;
"Bilal mengumandangkan adzan di tengah malam, maka silahkan kalian makan dan minum hingga adzan dikumandangkan, atau Beliau bersabda; Hingga kalian dengar adzan Ibnu Ummi Maktum. Dan Ibnu Ummi Maktum adalah seorang sahabat yang buta, yang dia tidak mengumandangkan adzan kecuali setelah orang-orang berkata kepadanya 'Heih, sekarang engkau telah berada di waktu pagi (sekarang giliranmu) .";1;0;1;
"Hai Abu bakar, apa yang menghalangimu ketika aku memberi isyarat kepadamu, namun engkau malah tidak melanjutkannya? Abu bakar menjawab; Tidak pantas bagi Ibnu Abu Quhafah mengimami Nabi Shallallahu 'alaihi wa Salam. Kemudian Nabi bersabda kepada para sahabat: Jika kalian ragu ketika shalat, hendaklah yang laki-laki mengucapkan tasbih, sedang jika perempuan menepukkan tangan (tashfiih).";1;0;1;
"Celaka kamu, sesungguhnya hijrah sangatlah berat. Apakah kamu memiliki unta?. Orang itu menjawab; Ya. Beliau bersabda: Apakah kamu telah mengeluarkan zakatnya? Orang itu menjawab; Ya. Beliau bertanya lagi: Apakah kamu perah susunya pada waktunya? Orang itu menjawab; Ya. Beliau bersabda: Beramallah sekalipun dari balik lautan, karena Allah tidak akan menyia-nyiakan amalanmu sedikitpun.";1;0;1;
Penuhilah nadzarnya. Sebagian orang mengatakan bahwa jika unta mencapai dua puluh ekor sehingga ia berkewajiban membayar zakat empat ekor kambing, lalu dia menghibahkan unta itu sebelum haul, atau menjualnya dengan niat atau siasat agar tidak terkena wajib zakat, maka tidak ada denda atasnya, demikian pula jika ia menyembunyikannya terus meninggal, maka tidak ada denda dalam hartanya.;1;0;1;
lalu kami singgah di suatu kaum (kampung) namun mereka tidak melayani kami (memberikan hak tamu) apa pendapat anda dalam masalah ini? Maka Beliau bersabda: Bagi kita, bila kalian singgah di suatu kaum diperintahkan bagi kalian untuk mendapatkan apa yang seharusnya didapat sebagai tamu, maka mintalah kepada mereka. Bila mereka tidak menunaikannya ambillah dari mereka sebatas hak tamu.;1;0;1;
lalu Allah Azza wa jalla menurunkan ayat: Dan orang-orang yang tidak menyembah tuhan yang lain beserta Allah dan tidak membunuh jiwa yang diharamkan Allah (membunuhnya) kecuali dengan (alasan) yang benar dan tidak berzina, dan turunlah ayat: Katakanlah: Hai hamba-hamba-Ku yang melampaui batas terhadap diri mereka sendiri, janganlah kamu berputus asa dari rahmat Allah. (Az Zumar: 53).;0;1;1;
Perumpamaan orang yang bergaul dengan orang shalih dan orang yang bergaul dengan orang buruk seperti penjual minyak wangi dan tukang tempa besi, Pasti kau dapatkan dari pedagang minyak wangi apakah kamu membeli minyak wanginya atau sekedar mendapatkan bau wewangiannya, sedangkan dari tukang tempa besi akan membakar badanmu atau kainmu atau kamu akan mendapatkan bau yang tidak sedap.;1;0;0;
Rasulullah melarang dari Al Muhaaqalah (jual beli buah yang masih ditangkai dengan gandum), Al Mukhodharoh (jual beli buah atau biji-bijian sebelum matang), Al Mulaamasah (terjadi jual beli jika calon pembeli memegang barang dagangan), Al Munaabadzah (jual beli dengan melempar barang dagangan) dan Al Muzaabanah (jual beli kurma yang masih dipohon dengan kurma yang sudah dipetik).;0;1;0;
"bagaimana dengan nasab (keturunan) ku?. Maka Hassan berkata; Aku pasti akan mengeluarkan (menyelamatkan) baginda dari mereka sebagaimana rambut dikeluarkan dari adonan. Dan dari bapaknya berkata; Aku pergi untuk mencela Hassan dihadapan 'Aisyah Radhiyallahu'anha, maka dia berkata; (Jangan kamu lakukan) karena dia pernah menyelamatkan (melindungi) Nabi Shallallahu 'alaihi wa salam";0;1;1;
Jika salah seorang diantara kalian bermimpi yang ia sukai, sebenarnya mimpi tersebut berasal dari Allah, maka hendaklah ia memuji Allah karenanya dan ceritakanlah, adapun jika ia bermimpi selainnya yang tidak disukai, maka itu berasal dari setan, maka hendaklah ia meminta perlindungan dari keburukannya, dan jangan menceritakannya kepada orang lain, sehingga tidak membahayakannya.;1;1;1;
Kenapa tidak dengan gadis sehingga kamu dapat bermain-main dengannya dan ia pun dapat bermain-main denganmu?. Ketika sudah mendekat dan akan sampai, kami pun pergi untuk segera masuk, maka beliau bersabda: Pelan-pelanlah hingga kalian masuk tepat pada malam (yaitu setelah shalat Isya) sehingga yang kusut rambutnya dapat bersisir dan isteri yang ditinggal bisa mempersiapkan diri.;1;0;1;
melarang menyewakan ladang lalu Ibnu'Umar Radhiyallahu'anhuma pergi menemui Rafi' dan aku pergi besamanya, lalu bertanya kepadanya maka dia menjawab bahwa Nabi melarang menyewakan ladang maka Ibnu'Umar Radhiyallahu'anhuma berkata: Sungguh kamu telah mengetahui bahwa kami menyewakan ladang pada masa Rasulullah dengan bagian seperempat atau dengan jerami yang harus kami bayarkan.;0;1;0;
Janganlah seorang yang berihram mengenakan kain gamis (jubah), surban, celana panjang, baju lengan panjang yang bertutup kepala dan tidak pula pakaian yang tercampuri dengan minyak za'faran dan wars (sejenis tumbuhan berwarna kuning atau kunyit) serta tidak pula mengenakan sepatu, kecuali jika ia tidak mendapatkan sandal, dan harus memotongnya lebih rendah dari kedua mata kaki.;0;1;1;
Bukankah Rasulullah telah mengharamkan Madinah? Ia menjawab, Benar, yaitu antara ini hingga itu, demikian pula tidak dibenarkan pohonnya ditebang, barangsiapa mengada-adakan keonaran (pelanggaran) di sana, maka baginya laknat Allah, malaikat dan semua manusia. 'Ashim berkata, Musa bin Anas mengabarkan kepadaku, bahwa beliau mengatakan: Atau melindungi orang yang berbuat salah.;0;1;1;
Janganlah kalian melaksanakan puasa wishal, maka siapa dari kalian yang mau melakukan puasa wishal hendaklah dia melakukannya hingga (makan) sahur. Mereka berkata: Bukankah anda melakukan puasa wishal, wahai Rasulullah? Beliau bersabda: Aku tidak sama dengan keadaan seorang kalian karena bagiku ada pemberi makan yang memberi aku makan dan pemberi minum yang memberi aku minum.;0;1;0;
"Siapa yang kepadanya Nabi memiliki hutang atau siapa yang pernah dijanjikan Beliau sesuatu hendaklah dia menemui kami. Jabir berkata; Aku katakan: Rasulullah pernah berjanji kepadaku untuk memberikan aku sesuatu sekian sekian. Maka dia mengulurkan tangannya tiga kali. Jabir berkata: Maka Abu Bakar memberikan ke tanganku lima ratus kemudian lima ratus kemudian lima ratus lagi.";1;0;1;
Nabi melarang makan daging keledai jinak. Telah menceritakan kepada kami Musaddad berkata, telah menceritakan kepada kami Yahya dari Ubaidullah berkata, telah menceritakan kepadaku Nafi' dari Abdullah ia berkata, Nabi melarang makan daging keledai jinak. Hadits ini dikuatkan oleh Ibnul Mubarak dari Ubaidullah dari Nafi', dan Abu Usamah menyebutkan dari Ubaidullah dari Salim.;0;1;0;
Orang-orang Quraisy pada masa Jahiliyah melaksanakan puasa hari 'Asyura' dan Rasulullah melaksanakannya. Ketika Beliau sudah tinggal di Madinah Beliau tetap melaksanakannya dan memerintahkan orang-orang untuk melaksanakannya pula. Setelah diwajibklan puasa Ramadhan Beliau meninggalkannya. Maka siapa yang mau silakan berpuasa dan siapa yang tidak mau silakan meninggalkannya.;1;0;0;
"Apa yang kalian kerjakan dengan tanah ladang kalian? Aku jawab: Kami memberi upah untuk pekerja dengan pembayaran seperempat bagian' atau sewasaq dari kurma atau gandum. Beliau bersabda: Janganlah kalian kerjakan tapi tanamilah oleh kalian sendiri atau pekerjakan orang tanpa bayaran atau kalian biarkan tanah kalian. Rafi' berkata; Aku katakan: Kami mendengar dan kami taati.";1;1;0;
Sesungguhnya kalian akan melihat Rabb kalian sebagaimana kalian melihat bulan ini. Kalian tidak akan kesulitan (ragu) ketika melihatnya. Jika kalian mampu untuk tidak ketinggalan shalat sebelum terbitnya fajar dan sebelum terbenamnya matahari maka lakukanlah. Kemudian beliau membaca: Dan bertasbihlah dengan memuji Rabbmu, sebelum terbit matahari dan terbenamnya. (Qaaf: 39).;1;0;1;
Apakah kamu punya bukti atau punggungmu dipukul? Maka dia berkata: Wahai Rasulullah, bila seorang dari kami melihat ada seorang laki-laki bersama isterinya, apakah dia harus mencari bukti? Beliau kontan mengatakan 'Harus ada bukti, punggungmu harus didera (atas tuduhan ini). Lalu diceritakanlah tentang hadits lain (saling melaknat antara yang menuduh dengan yang dituduh).;1;0;1;
Ribath (bersiap siaga) satu hari di jalan Allah lebih baik dari dunia dan apa saja yang ada diatasnya dan tempat cambuk seorang dari kalian di surga lebih baik dari pada dunia dan apa saja yang ada diatasnya dan berangkat pada awal hari (pagi) atau berangkat pada akhir hari (siang) untuk berperang di jalan Allah lebih baik dari pada dunia dan apa saja yang ada diatasnya .;1;0;1;
Janganlah kalian mengenakan gamis (jubah), celana panjang, surban, baju panjang yang bertutup kepala dan tidak pula sepatu kecuali jika seseorang tidak mendapatkan sandal, maka ia boleh mengenakan sepatu di bawah mata kaki, dan janganlah kalian mengenakan pakaian yang dicampuri dengan minyak za'faran dan tidak juga wars (sejenis tumbuhan yang berwarna kuning atau kunyit).;1;1;1;
"Tapi bagaimana dengan nasab (keturunan) ku? Hasan berkata; Aku pasti akan mengeluarkan (menyelamatkan) tuan dari mereka sebagaimana rambut dikeluarkan dari adonan tepung. Dan dari Hisyam bin 'Urwah dari Ayahnya dia berkata; Aku pernah pergi untuk mencela Hasan di hadapan Aisyah, maka dia berkata; Jangan kamu mencelanya, karena dia pernah menyelamatkan (melindungi) Nabi .";0;1;1;
Lakukanlah amal-amal yang kalian sanggup melaksanakannya, karena Allah tidak akan berpaling (dalam memberikan pahala) sampai kalian yang lebih dahulu berpaling (dari mengerjakan amal) . Dan shalat yang paling Nabi cintai adalah shalat yang dijaga kesinambungannya sekalipun sedikit. Dan Beliau bila sudah biasa melaksanakan shalat (sunnat) beliau menjaga kesinambungannya.;1;0;0;
"Ada seorang laki-laki yang biasa memberi pinjaman (piutang) kepada orang lain dan dia berpesan kepada muridnya; Jika kamu datangi mereka untuk menagih tapi mereka dalam kesulitan maka bebaskanlah, sebab dengan begitu semoga Allah membebaskan kita (pada hari qiamat) . Beliau bersabda: Maka orang itu berjumpa dengan Allah Ta'ala lalu Allah membebaskannya (mengampuninya) .";1;0;1;
"Rasulullah melarang puasa wishal sebagai bentuk kasih sayang kepada mereka (para sahabat). Mereka berkata: Bukankah anda sendiri melakukan puasa wishal? Beliau bersabda: Aku tidak sama dengan keadaan seorang kalian karena aku diberi makan dan minum oleh Rabbku. Abu 'Abdullah Al Bukhariy berkata: 'Utsman tidak menyebut kalimat; Sebagai bentuk kasih sayang kepada mereka.";0;1;0;
Akan terjadi fitnah, ketika itu yang duduk lebih baik daripada yang berdiri, yang berdiri lebih baik daripada yang berjalan, yang berjalan lebih baik daripada yang berlari, barangsiapa berusaha menghadapi fitnah itu, justru fitnah itu akan mempengaruhinya, maka barangsiapa mendapat tempat berlindung atau base camp pertahanan, hendaklah ia berlindung diri di tempat itu.;1;0;1;
"Mengapa tikar ini ada disini. Aku berkata; Aku membuatnya untuk tuan agar tuan dapat berbaring. Beliau Shallallahu 'alaihi wa salam bersabda: Tidak tahukah kamu bahwa malaikat tidak akan memasuki rumah yang di dalamnya ada gambar, dan orang yang membuat gambar akan disiksa pada hari qiyamat, dan akan dikatakan kepada mereka; hidupkanlah apa yang telah kalian ciptakan.";0;1;1;
shadaqah apakah yang paling besar pahalanya?. Beliau menjawab: Kamu bershadaqah ketika kamu dalam keadaan sehat dan kikir, takut menjadi faqir dan berangan-angan jadi orang kaya. Maka janganlah kamu menunda-nundanya hingga tiba ketika nyawamu berada di tenggorakanmu. Lalu kamu berkata, si fulan begini (punya ini) dan si fulan begini. Padahal harta itu milik si fulan.;1;0;1;
"Wahai Amirul Mukminin, Sesungguhnya Allah Ta'ala berfirman kepada Nabi : Jadilah engkau pema'af dan suruhlah orang mengerjakan yang ma'ruf, serta berpalinglah dari pada orang-orang yang bodoh. Dan ini terhadap orang-orang yang bodoh. Ibnu Abbas berkata; maka demi Allah, Umar pun tidak menyakitinya ketika ayat itu dibacakan kepadanya. Ia berhenti mendengar Kitabullah.";1;0;1;
Di Madinah kami adalah orang-orang yang paling banyak bercocok tanam, sering kami menyewa tanah di sebuah kawasan tertentu milik tuan tanah, diantaranya ada yang gagal dan tanah masih seperti apa adanya, dan diantaranya ada yang berhasil sehingga tanah menjadi rusak, sehingga di kemudian hari kami dilarang sewa-menyewa tanah ini. Ketika itu, emas dan uang belum ada.;0;1;1;
Saya hanyalah manusia biasa, dan kalian mengadukan sengketa kepadaku, siapa tahu sebagian diantara kalian lebih pandai bersilat lidah dengan alasannya dari sebagian lain, sehingga aku memutuskan sebatas yang aku dengar, maka barangsiapa kuputuskan menang dengan mendzalimi hak saudaranya, janganlah ia mengambilnya, sebab aku akan mengambil sulutan api neraka baginya.;0;1;1;
"Tidak lama lagi Eufrat tersingkap perbendaharaan-perbendaharaan emasnya, maka barangsiapa mendatanginya, jangan ia mengambilnya sedikitpun. Kata Uqbah; telah menceritakan kepada kami Ubaidullah telah menceritakan kepada kami Abu Az Zanad dari Al A'raj dari Abu Hurairah dari Nabi semisal hadits diatas, hanyasanya dia mengatakan dengan redaksi; tersingkap gunung emas.";0;1;1;
Sekiranya salah seorang diantara kalian ingin mendatangi isterinya, maka panjatkanlah doa: 'BISMIKALLAAHUMMA JANNIBNASY WAJANNIBISYSYAITHAANA MAA RAZAQTANAA (Dengan nama Allah, jauhkanlah kami dari setan dan jauhkanlah setan yang Engkau anugerahkan kepada kami) ', jika ditakdirkan memperoleh anak dari keduanya, maka setan tak bakalan membahayakannya selama-lamanya.;1;0;1;
Dua orang yang melakukan jual beli boleh melakukan khiyar (pilihan untuk melangsungkan atau membatalkan jual beli) selama keduanya belum berpisah, Atau sabda Beliau: hingga keduanya berpisah. Jika keduanya jujur dan menampakkan dagangannya maka keduanya diberkahi dalam jual belinya dan bila menyembunyikan dan berdusta maka akan dimusnahkan keberkahan jual belinya.;1;0;1;
Apakah semua kurma Khaibar seperti ini? Maka orang itu menjawab: Sesungguhnya kami mengambil satu sha'jenis kurma ini dengan dua sha' kurma lain dan dua sha'kurma ini dengan tiga sha' kurma lain. Maka Beliau bersabda: Janganlah kamu berbuat seperti itu. Juallah dengan dirham kemudian belilah dengan dirham pula. Dan bersabda: Dan dengan timbangan seperti itu pula.;0;1;1;
"Tidaklah bayi yang dilahirkan kecuali setan akan menyentuhnya ketika ia lahir, sehingga mereka menangis keras karena sentuhan setan tersebut, kecuali Maryam dan putranya. Lalu Abu Hurairah berkata; Jika kalian mau bacalah; dan aku mohon perlindungan untuknya serta anak-anak keturunannya kepada (pemeliharaan) Engkau daripada syaitan yang terkutuk. (Ali Imran: 36).";1;0;1;
Tidaklah seseorang mengenakan kain sutera ketika di dunia, melainkan tidak akan dikenakan kepadanya kelak di Akhirat. Telah menceritakan kepada kami Al Hasan bin Umar telah menceritakan kepada kami Mu'tamir telah menceritakan kepada kami Ayahku telah menceritakan kepada kami Abu Utsman kemudian Abu Utsman mengisyaratkan dengan jari telunjuknya dan jari tengahnya.;0;1;1;
"Ya Allah berilah aku mati syahid dijalanMu, dan jadikanlah kematianku di negeri RasulMu, ). Dan Ibnu Zurai' berkata, dari Rauh bin Al Qasim dari Zaid bin Aslam dari bapaknya dari Hafshah binti 'Umar Radhiyallahu'anhuma berkata; Aku mendengar 'Umar seperti hadits ini. Dan Hisyam berkata, dari Zaid dari bapaknya dari Hafshah; Aku mendengar 'Umar Radhiyallahu'anhu.";1;0;1;
perwalianmu menjadi hakku. Lalu Barirah menyampaikan hal ini kepada tuannya namun mereka menolaknya seraya berkata: Jika dia mau untuk membayarmu silakan tapi perwalian tetap menjadi milik kami. Kemudian hal ini disampaikkan oleh 'Aisyah kepada Rasulullah , maka Beliau bersabda: Belilah dia lalu bebaskanlah karena perwalian menjadi hak orang yang membebaskannya.;1;0;1;
Janganlah kalian berjual beli emas dengan emas kecuali sama jumlahnya dan jangan kalian lebihkan yang satu atas lainnya dan janganlah kalian berjual beli uang kertas dengan uang kertas kecuali sama jumlahnya dan jangan kalian lebihkan yang satu atas lainnya dan janganlah kalian berjual beli yang disegerakan (hadir) dengan yang diakhirkan (ghoib, ditangguhkan) .;0;1;0;
Kembalilah kalian untuk menemui isteri-isteri kalian, berdiamlah bersama mereka, ajari dan suruhlah mereka, dan beliau menyebut beberapa perkara yang sebagian kami ingat dan sebagiannya tidak, dan shalatlah sebagaimana kalian melihat aku shalat. Jika shalat telah tiba, hendaklah salah seorang di antara kalian melakukan adzan dan yang paling dewasa menjadi imam.;1;0;1;
Tidaklah salah seorang di antara kalian melainkan telah ditetapkan tempat tinggalnya di neraka atau di surga.' Para sahabat bertanya, 'Kalau begitu, tidak sebaiknyakah kita bertawakkal saja? ' Nabi menjawab: 'Beramallah kalian, sebab masing-masing telah dimudahkan, dan beliau mengutip ayat: '(Adapun orang yang memberi hartanya dan bertakwa) ', (Qs. Al Lail: 5).;1;0;1;
Jika kalian menemukan si anu dan si anu maka bakarlah keduanya dengan api. Kemudian Rasulullah bersabda ketika kami hendak berangkat (keesokan harinya): Sungguh aku telah memerintahkan kalian agar membakar si anu dan si anu dan sesungguhnya tidak boleh ada yang menyiksa dengan api kecuali Allah.. Maka itu, bila kalian menemukan keduanya maka bunuhlah keduanya.;0;1;1;
Janganlah kalian mengharapkan berjumpa dengan musuh. Dan berkata Abu 'Amir telah bercerita kepada kami Mughiroh bin 'Abdur Rohman dari Abu az Zanad dari Al A'roj dari Abu Hurairah Radhiyallahu'anhu dari Nabi Shallallahu'alaihiwasallam bersabda: Janganlah kalian mengharapkan berjumpa dengan musuh. Dan jika kalian telah berjumpa dengan mereka, maka bershabarlah.;1;1;1;
memerintahkan kami untuk bersedekah, maka salah seorang dari kami berusaha mencari sesuatu yang bisa disedekahkan, hingga ia datang dengan membawa satu mud -hasil kerja kerasnya- yang ia berikan kepada Rasulullah Shalallahu 'Alaihi Wa Sallam. Sungguh sekarang aku mengetahui seseorang yang memiliki seratus ribu, seakan-akan dia telah menawarkan dirinya sendiri.;1;0;1;
"Siapa yang menjulurkan pakaiannya (hingga ke bawah mata kaki) dengan sombong, maka Allah tidak akan melihatnya pada hari Kiamat kelak. Lalu Abu Bakar berkata; Wahai Rasulullah, sesungguhnya salah satu dari sarungku terkadang turun sendiri, kecuali jika aku selalu menjaganya? lalu Nabi bersabda: Engkau bukan termasuk orang yang melakukan hal itu karena sombong.";0;1;1;
Sesungguhnya berdusta kepadaku tidak sama dengan orang yang berdusta kepada orang lain. Barangsiapa yang berdusta atas namaku dengan sengaja maka hendaklah dia bersiap-siap (mendapat) tempat duduknya di neraka. Aku juga mendengar Nabi Shallallahu'alaihiwasallam bersabda: Barangsiapa yang meratapi mayat maka mayat itu akan disiksa disebabkan ratapan kepadanya.;0;1;1;
"Seseorang dari kalian apabila mendatangi istrinya (untuk berjima') kemudian membaca do'a; Allahumma jannibnasy syaithaana wa jannibisy syaithaana maa razaqtanaa (Ya Allah, jauhkanlah kami dari setan dan jauhkanlah pula dari anak yang kelak Engkau karuniakan kepada kami), kemudian bila keduanya dikaruniai anak maka setan tidak akan dapat mencelakakan anak itu.";1;0;1;
"Tidaklah salah seorang diantara kalian selain telah ditentukan tempat tinggalnya di neraka atau di surga. Maka seseorang berujar; 'kalau begitu, kita bertawakkal saja ya Rasulullah? ' Nabi menjawab: Jangan, beramallah, sebab semua orang telah dimudahkan, kemudian beliau membaca ayat; 'Adapun orang yang memberikan hartanya lantas bertaqwa' (QS. Allail ayat 5).";1;0;1;
Janganlah kalian menjual kurma kecuali setelah jelas bagusnya dan janganlah kalian berjual beli kurma matang dengan kurma basah . Salim berkata, dan telah mengabarkan kepada saya 'Abdullah dari Zaid bin Tsabit bahwa Rasulullah telah memberi kelonggaran dalam jual beli 'ariyyah yaitu kurma muda dengan kurma matang dan tidak memberi kelonggaran pada selainnya.;0;1;1;
Saya hanyalah manusia biasa, dan kalian seringkali mengadukan sengketa kepadaku, bisa jadi sebagian diantara kalian lebih pandai bersilat lidah daripada lainnya sehingga aku putuskan seperti yang kudengar, maka barangsiapa yang kuputuskan menang dengan menganiaya hak saudaranya, janganlah ia mengambilnya, sebab sama artinya aku ambilkan sundutan api baginya.;0;1;1;
ada seseorang menyiapkan barang dagangan dipasar, lalu ia bersumpah atas nama Allah, sesungguhnya ia telah memberikan barang tersebut dengan apa yang tidak ada padanya kepada seseorang dari kaum muslimin, lalu turunlah ayat: (Sesungguhnya orang-orang yang menukar janjinya dengan Allah dan sumpah-sumpah mereka dengan harga yang sedikit). (QS Al 'Imran: 77).;0;1;0;
berhenti singgah disana, begitu juga 'Umar dan Ibnu 'Umar. Dan dari Nafi' bahwa Ibnu'Umar radhiyallahu'anhuma pernah disana, yaitu di Al Muhashshab, shalat Zhuhur, dan 'Ashar. Dan aku menduga dia berkata: dan shalat Maghrib. Khailid berkata: Aku tidak meragukan tentang shalat 'Isya', lalu dia tidur sejenak disana. Lalu dia menyebutkan hal itu dari Nabi .;1;0;1;
Apakah semua kurma Khaibar seperti ini? Orang itu berkata: Demi Allah, tidak wahai Rasulullah, sesungguhnya kami menukar (barter) satu sha' dari jenis kurma ini dengan dua sha' kurma lain dan dua sha' kurma ini dengan tiga sha' kurma lain. Maka Rasulullah bersabda: Janganlah kamu melakukannya, juallah semua dengan dirham kemudian beli dengan dirham pula.;0;1;0;
Janganlah kalian mengistimewakanku di atas Musa, sebab manusia di hari kiamat nanti akan pingsan sehingga akulah manusia pertama-tama yang bisa siuman. Tiba-tiba Musa telah berdiri di samping 'arsy, sehingga aku tidak tahu apakah dia termasuk yang pingsan ataukah dia telah siuman sebelumku, atau dia diantara manusia yang Allah kecualikan (tidak pingsan).;0;1;1;
Barangsiapa yang menegakkan lailatul qadar (mengisi dengan ibadah) karena iman kepada Allah dan mengharapkan pahala (hanya dariNya) maka akan diampuni dosa-dosa yang telah dikerjakannya, dan barangsiapa yang melaksanakan shaum Ramadhan karena iman kepada Allah dan mengharapkan pahala (hanya dariNya) maka akan diampuni dosa-dosa yang telah dikerjakannya.;1;0;1;
Bukan itu maksudnya. Sesungguhnya yang dimaksud dengan kezhaliman pada ayat itu adalah syirik. Apakah kalian belum pernah mendengar apa yang diucapkan Luqman kepada anaknya saat dia memberi pelajaran: (Wahai anakku, Janganlah kamu berbuat syirik (menyekutukan Allah), karena sesungguhnya syirik itu benar-benar kezhaliman yang besar). (QS Luqman ayat 13).;0;1;1;
"Saya lihat penyakitmu sudah demikian parah, apakah kamu mempunyai seekor kambing? saya menjawab; Tidak. Beliau bersabda: 'Berpuasalah tiga hari, atau memberi makan kepada enam orang miskin yakni sebanyak tetengah sha' untuk setiap orang dan cukurlah rambutmu. Ka'ab berkata; Maka ayat ini turun khusus berkenaan denganku, namun bagi kalian bersifat umum.";1;0;1;
Maukah aku tunjukkan kepada kalian sesuatu yang lebih baik bagi kalian berdua daripada seorang pelayan, apabila kalian berdua hendak tidur maka bertakbirlah kepada Allah sebanyak tiga puluh tiga kali, bertasbihlah sebanyak tiga puluh tiga kali dan bertahmidlah sebanyak tiga puluh empat, dan ini semua lebih baik buat kalian berdua dari seorang pelayan.';1;0;1;
Benarkah kabar bahwa kamu selalu mendirikan shalat di malam hari dan shaum pada siang harinya? Aku jawab: 'Benar . Beliau bersabda: Sungguh jika kamu lakukan terus menerus maka nanti matamu letih dan jiwamu lemah. Sungguh untuk dirimu ada haknya, juga keluargamu punya hak, maka shaumlah dan juga berbukalah, bangun untuk shalat malam dan juga tidurlah.;1;0;1;
"Jauhilah tujuh dosa besar yang membinasakan. Para sahabat bertanya; 'Ya Rasulullah, apa saja tujuh dosa besar yang membinasakan itu? ' Nabi menjawab; menyekutukan Allah, sihir, membunuh jiwa yang Allah haramkan tanpa alasan yang benar, makan riba, makan harta anak yatim, lari dari medan perang, dan menuduh wanita mukmin baik-baik melakukan perzinahan.";0;1;1;
Sesungguhnya Allah berada dihadapan setiap orang dari kalian (saat shalat). Maka bila sedang shalat janganlah seseorang meludah atau sabdanya: janganlah dia membuang dahak. Kemudian Beliau turun lalu menggosok ludah tersebut dengan tangannya. Dan berkata, Ibnu'Umar radhiyallahu'anhuma: Jika seorang dari kalian meludah, maka meludahlah kearah kirinya.;1;1;1;
(barangsiapa diantara pemelihara itu yang mampu maka hendaknya ia menehan diri dari memakan harta anak yatim itu, dan barangsiapa yang miskin maka ia boleh makan harta itu menurut yang patut), ayat ini turun pada wali anak yatim yang memelihara dan menjaga hartanya, dan jika ia seorang miskin maka ia boleh memakannya dengan cara ma'ruf (yang patut).;1;0;1;
Barangsiapa bersumpah dengan agama selain Islam, maka dia seperti yang dikatakannya, dan barangsiapa membunuh dirinya dengan sesuatu, ia disiksa di neraka jahannam dengan sesuatu yang digunakannya untuk bunuh diri, dan melaknat seorang mukmin bagaikan membunuhnya, dan barangsiapa menuduh seorang mukmin dengan kekafiran, maka dia seperti membunuhnya.;0;1;1;
Hai manusia, rendahkanlah suara kalian ketika berdoa, sebab kalian tidak menyeru dzat yang tuli lagi tidak ghaib, hanyasanya kalian menyeru kepada Dzat yang Maha mendengar lagi Maha melihat. Kemudian beliau bersabda: hai Abdullah bin Qais, maukah kamu kuajari kalimat yang menjadi harta karun surga?, yaitu ucapan laa-haula walaa quwwata illa billah.;1;0;1;
