hadis;anjuran;larangan;informasi;kitab
Aku sudah melaksanakan i'tikaf pada sepuluh malam sebelumnya dari bulan ini kemudian dinampakkan kepadaku agar beri'tikaf pada sepuluh hari terakhir, maka siapa yang telah beri'tikaf bersamaku tetaplah pada tempatnya beri'tikaf. Sungguh telah diperlihatkan kepadaku tentang malam Lailatul Qadar namun aku dilupakan waktunya yang pasti, maka carilah pada sepuluh malam-malam akhir dan carilah pada malam yang ganjil. Sungguh aku melihat diriku (dalam mimpi) sujud diatas air dan tanah (yang becek) . Kemudian langit tampak mendung pada malam itu lalu turunlah hujan hingga masjid bocor mengenai posisi tempat shalat Nabi pada malam kedua puluh satu. Kemudian mataku memandang Rasulullah , aku melihat Beliau setelah Shubuh dengan wajah Beliau yang penuh dengan tanah dan air.;1;0;1;
Jika kamu melepas anjingmu dengan menyebut nama Allah, lalu ia menangkap, membunuh dan memakannya, maka janganlah kamu makan. Sebab ia menangkap untuk dirinya sendiri. Aku bertanya lagi, Saat melepas anjingku aku mendapatkan ada anjing lain bersamanya, dan aku tidak tahu anjing mana yang telah menangkapnya? Beliau lalu menjawab: Jangan kamu makan, sebab engkau menyebut nama Allah hanya untuk anjingmu dan bukan untuk anjing lainnya. Aku lalu bertanya kepada beliau tentang hasil buruan dengan Mi'radl, maka beliau pun menjawab: Jika yang mengenai adalah pada bagian yang tajam maka makanlah, namun jika yang mengenai adalah pada bagian yang tumpul hingga terbunuh, sesungguhnya itu adalah Waqidz (hewan yang dibunuh bukan dengan senjata tajam), maka jangan kamu makan.;1;0;0;
Apakah kalian mau berbai'at kepadaku bahwa kalian tidak akan menyekutukan Allah dengan sesuatu apa pun, dan kalian tidak akan berzina dan tidak pula akan mencuri? kemudian beliau membaca ayat dari surat An Nisa`. Dan mayoritas redaksi Sufyan Ia membacakan ayat (Bukan ayat surat Annisa'). Barangsiapa di antara kalian yang memenuhi janjinya, maka ganjaran pahala ada di sisi Allah. Dan siapa yang melanggar satu darinya lalu ia disiksa, maka hal itu adalah kafarah baginya. Namun, siapa yang melanggar satu darinya lalu Allah menyembunyikan kesalahannya, maka dosa hal itu kembali kepada Allah, bila Dia berkehendak, maka Dia akan menyiksanya, dan bila menghendaki, Dia akan mengampuninya. Hadits ini diperkuat oleh Abdurrazzaq dari Ma'mar, yakni terkait dengan ayat.;1;1;1;
"melarang menjual buah-buahan hingga sempurna. Ada yang bertanya apa; Apa tanda sempurnanya? Beliau menjawab: Ia menjadi merah . Lalu Rasulullah bersabda: Coba kau renungkan, bagaimana sekiranya Allah mencegah kurma menjadi masak hanya karena salah seorang diantara kalian mengambil harta saudaranya! Al Laits berkata; telah menceritakan kapada saya Yunus dari Ibnu Syihab berkata: Seandainya seseorang menjual buah sebelum nampak kebaikannya kemudian terserang hama (penyakit) maka tanggung jawabnya pada pemiliknya. Telah mengabarkan kepada saya Salim bin 'Abdullah dari Ibnu'Umar radhiyallahu'anhuma bahwa Rasulullah bersabda: Janganlah kalian saling berjual beli buah-buahan hingga tampak kebaikannya dab jangan pula menjual kurma matang dengan kurma mentah.";0;1;1;
"Sungguh kamu pasti tidak akan sanggup melaksanakannya. Akan tetapi berpuasalah dan berbukalah, shalat malam dan tidurlah dan berpuasalah selama tiga hari dalam setiap bulan karena setiap kebaikan akan dibalas dengan sepuluh kebaikan yang serupa, dan itu seperti puasa sepanjang tahun . Aku katakan; Sungguh aku mampu lebih dari itu. Belau berkata: Kalau begitu puasalah sehari dan berbukalah selama dua hari. Aku katakan lagi: Sungguh aku mampu yang lebih dari itu. Beliau berkata: Kalau begitu puasalah sehari dan berbukalah sehari, yang demikian itu adalah puasanya Nabi Allah Daud 'alaihi salam yang merupakan puasa yang paling utama.. Aku katakan lagi: Sungguh aku mampu yang lebih dari itu. Maka beliau bersabda: Tidak ada puasa yang lebih utama dari itu.";1;0;1;
"Allah dan RasulNya telah mengharamkan khamar, bangkai, babi dan patung-patung. Ada yang bertanya: Wahai Rasulullah, bagaimana dengan lemak dari bangkai (sapi dan kambing) karena bisa dimanfaatkan untuk memoles sarung pedang atau meminyaki kulit-kulit dan sebagai bahan minyak untuk penerangan bagi manusia?. Beliau bersabda: Tidak, dia tetap haram. Kemudian saat itu juga Rasulullah bersabda: Semoga Allah melaknat Yahudi, karena ketika Allah mengharamkan lemak hewan (sapi dan kambing) mereka mencairkannya lalu memperjual belikannya dan memakan uang jual belinya. Berkata, Abu 'Ashim telah menceritakan kepada kami 'Abdul Hamid telah menceritakan kepada kami Yazid; 'Atho' menulis surat kepadaku yang katanya dia mendengar Jabir Radhiyallahu'anhu dari Nabi .";0;1;1;
"Apa yang mengahalangimu untuk datang kepadaku? Abu Sa'id menjawab; saya sedang shalat. Beliau bersabda: Bukankah Allah Tabaraka Wa Ta'ala telah berfirman: Hai orang-orang yang beriman, penuhilah seruan Allah dan seruan Rasul apabila Rasul menyeru kamu kepada suatu yang memberi kehidupan kepada kamu. (Al Anfal: 24). Lalu beliau bersabda: Maukah saya ajarkan surat yang paling agung dalam alqur'an sebelum saya keluar dari masjid ini?. Abu Sa'id bin Al-Mu'alla berkata; ketika Rasulullah Shallallahu'alaihi wa sallam hendak pergi, saya mengingatkan beliau, lalu beliau bersabda: Segala puji bagi Allah rabb semesta alam. (Al Fatihah: 2), itu adalah termasuk Assabu' Al-Matsani (tujuh ayat yang terulang-ulang) dan Al- quran yang agung yang diberikan kepadaku.";1;0;1;
"darahmu, hartamu, kehormatanmu adalah suci satu sama lain seperti sucinya hari milikmu ini, di kotamu ini, di bulanmu ini; dan sesungguhnya, kalian akan berjumpa dengan Tuhan kalian dan Dia akan menanyakan perbuatan-perbuatan kalian. Hati-hatilah! Jangan kembali menjadi orang-orang sesat sepeninggalku, saling memenggal leher satu sama lain. Sudah menjadi kewajiban mereka yang hadir (di sini hari ini) untuk menyampaikan pesanku ini kepada mereka yang tidak hadir. Mungkin mereka yang tidak hadir akan lebih memahami (pesan ini) dari pada mereka yang hadir pada saat ini. -Muhammad (perawi) ketika menyebutkan Hadits ini selalu berkata; 'Sungguh benar Nabi .- Nabi kemudian berkata dua kali: Ketahuilah! Bukankah telah ku sampaikan (pesan Allah) kepadamu?";1;1;1;
Turunlah disini dan siapkan minuman buatku. Orang itu berkata: Wahai Rasulullah, bukankah masih ada matahari? Beliau berkata, lagi: Turunlah (berhenti disini) dan siapkan minuman buatku. Orang itu berkata, lagi: Wahai Rasulullah, bukankah masih ada matahari? Beliau berkata, lagi: Turunlah dan siapkan minuman buatku. Maka orang itu berhenti lalu memberikan minuman kepada Beliau, lalu Beliau minum kemudian melempar sesuatu dengan tangan Beliau ke suatu arah lalu bersabda: Apabila kalian telah melihat malam sudah datang dari arah sana maka orang yang puasa sudah boleh berbuka . Hadits inidikuatkan pula oleh Jarir dan Abu Bakar bin 'Ayyasy dari Asy-Syaibaniy dari Ibnu Abu Awfa Radhiyallahu'anhu berkata: Aku pernah bersama Nabi dalam suatu perjalanan.;1;0;1;
Mandikanlah ia dengan mengguyurkan air yang dicampur dengan daun bidara tiga kali, lima kali atau lebih dari itu jika kalian anggap perlu dan jadikanlah yang terakhirnya dengan kafur barus dan bila kalian telah selesai beritahu aku. Berkata, Ummu 'Athiyyah Radhiyallahu'anha: Ketika kami telah selesai, Beliau kemudian memberikan kain Beliau kepada kami seraya berkata: Pakaikanlah ini kepadanya. Dan Beliau tidak memerintahkan lebih dari itu dan aku sendiri sudah tidak ingat puteri Beliau mana yang meninggal saat itu. Ayyub berpendapat memakaikan kain maksudnya adalah menutupi seluruh badan mayat perempuan. Dan begitu juga bahwa Ibnu Sirin memerintahkan agar untuk jenazah perempuan ditutupi selluruh bagian badannya bukan hanya bagian bawahnya.;1;0;1;
Apakah kamu memiliki budak untuk kamu bebaskan? Orang itu menjawab: Tidak. Lalu Beliau bertanya lagi: Apakah kamu sanggup bila harus berpuasa selama dua bulan berturut-turut? Orang itu menjawab: Tidak. Lalu Beliau bertanya lagi: Apakah kamu memiliki makanan untuk diberikan kepada enam puluh orang miskin? Orang itu menjawab: Tidak. Kemudian Nabi diberikan satu keranjang berisi kurma, keranjang besar yang biasa untuk menampung sampah, lalu Beliau berkata: Berilah makan orang lain dengan kurma ini. Orang itu berkata: Apakah ada orang yang lebih membutuhkan dari kami? Tidak ada keluarga yang tinggal diantara dua perbatasan yang lebih membutuhkan bantuan daripada kami. Maka Beliau berkata: Kalau begitu berilah makan keluargamu dengan kurma ini.;1;0;0;
"apabila membaca Al Qur'an, beliau tidak berbicara hingga selesai membacanya. Pada suatu hari aku mengambil mushaf-nya, maka membaca surat Al Baqarah hingga selesai dengan hafalannya. Lalu dia berkata; tahukah kamu tentang apa surat ini turun? Aku menjawab; 'Tidak.' Dia berkata; surat ini turun tentang ini dan itu kemudian dia pergi.' Dan dari Abdus Shamad Telah menceritakan kepadaku ayahku telah menceritakan kepadaku Ayyub dari Nafi dari Ibnu Umar mengenai ayat; istri-istrimu adalah ladang bagimu maka datangilah ladang-ladangmu kapan saja sesuai yang kamu sukai.(QS. Albaqarah 223), Ibnu Umar berkata; yaitu mendatanginya dari kemaluannya. Diriwayatkan oleh Muhammad bin Yahyan bin Sa'id dari Bapaknya dari Ubaidullah dari Nafi dari Ibnu Umar.";1;0;1;
Sesungguhnya darah kalian, harta kalian -Muhammad berkata, dan seingatku beliau bersabda dan kehormatan kalian- adalah haram sebagaimana kehormatan hari kalian sekarang, di negeri kalian sekarang, di bulan kalian sekarang, dan kalian akan menemui Rabb kalian dan Dia akan menanyai kalian perihal amal kalian. Ingat, jangan kalian kembali sepeninggalku menjadi orang yang sesat, sebagian kalian memenggal leher sebagian lainnya, ingat, hendaklah yang hadir menyampaikan kepada yang tidak hadir, karena bisa jadi orang yang menyampaikannya jauh lebih paham dari orang yang mendengarnya. Dan Muhammad jika menyebut hadis ini, Nabi ShallAllahu 'alaihi wa Salam benar, kemudian beliau bersabda: Bukankah telah aku sampaikan? Bukankah telah aku sampaikan?;1;1;1;
Siapa yang membebaskan hak kepemilikan budak. Telah menceritakan kepada kami Musaddad telah menceritakan kepada kami YAzid bin Zurai' telah menceritakan kepada kami Sa'id dari Qatadah dari An-Nadhar bin Anas dari Basyir bin Nahik dari Abu Hurairah Radhiyallahu'anhu bahwa Nabi berkata: Siapa yang membebaskan bagian atau hak kepemilikan budak yang dimilki secara berserikat, maka pembebasan total budak itu menjadi kewajibannya jika ia mempunyai harta. Jikalah tidak, maka harga budak tersebut ditaksir secara adil, lantas budak diusahakan untuk dibebaskan dengan tanpa membebani orang yang telah membebaskan hak kepemilikannya. Hadis ini diperkuat oleh Hajjaj bin Hajjaj dan Abban dan Musa bin Khalaf dari Qatadah yang diringkas oleh Syu'bah.;1;0;1;
apabila beliau pergi berperang mereka tidak turut berperang dan merasa bangga dengan ketidakpergiannya untuk menyelisihi Rasulullah . Apabila Rasulullah telah kembali (membawa kemenangan dan harta rampasan perang), mereka mengemukakan alasan mereka masing-masing yang menjadikan mereka tidak turut berperang dan menguatkan alasannya dengan sumpah. Kemudian mereka ingin dipuji (seolah-olah merekalah yang pahlawan) padahal mereka tidak berbuat apa-apa. Karena itu turunlah ayat: 'Janganlah sekali-kali kamu menyangka bahwa orang-orang yang gembira dengan apa yang telah mereka kerjakan dan mereka ingin dipuji terhadap perbuatan yang tidak mereka kerjakan, janganlah kamu mengira bahwa mereka akan terlepas dari siksa' (QS Ali Imraan (3): 88).;0;1;1;
Rasulullah melarang wishal dalam berpuasa. Kemudian ada seseorang dari kalangan Kaum Muslimin yang berkata kepada Beliau: Bukankah anda melakukan puasa wishal, wahai Rasulullah? Maka Beliau berkata: Siapa dari kalian yang keadaannya sama denganku? Aku tidak sama dengan keadaan seorang kalian karena Rabbku selalu memberiku makan dan minum. Tatkala mereka enggan menghentikan kebiasaan puasa wishal, maka Beliau melakukan puasa wishal bersama mereka hari demi hari, kemudian mereka melihat hilal. Maka ketika itu Beliau bersabda: Kalau hilal itu tidak datang (terlambat) pasti aku akan menambah lagi puasa wishal bersama kalian. Ucapan ini Beliau sampaikan sebagai bentuk sindiran kepada mereka ketika mereka enggan menghentikan puasa wishal.;0;1;0;
"Seandainya aku bisa mengulang kembali urusanku yang telah kulakukan niscaya aku tidak membawa sembelihan, dan seandainya aku tidak membawa hewan sembelihan (Al hadyu) tentu aku akan bertahallul. Maka Suraqah bin Malik bin Ju'tsum berkata: Wahai Rasulullah, ketentuan itu berlaku khusus untuk kami saja atau untuk selamanya? Beliau bersabda: Tidak, tapi untuk selamanya. Jabir berkata: Kemudian datang 'Ali bin Abu Tholib. Lalu seorang dari keduanya berkata; 'Ali berkata: Labbaik, aku berniat hajji sebagaimana Rasulullah bertalbiyah (berniat hajji). Dan dia berkata: Berkata, yang lain: Labbaik, aku berniat hajji seperti hajjinya Rasulullah . Maka Nabi memerintahkan untuk mengenakan ihramnya dan mengambil bagian pada hewan sembelihannya.";1;0;1;
barangsiapa yang membaca laa ilaaha illallahu wahdahuu laa syariika lahuu, lahul mulku wa lahul hamdu wa huwa 'alaa kulli syai'in qodir (Tidak ada ilah (yang berhaq disembah) selain Allah Yang Maha Tunggal tidak ada sekutu bagi-Nya. Milik-Nya kerajaan dan bagi-Nya segala puji dan Dia Maha Kuasa atas segala sesuatu) sebanyak seratus kali dalam sehari, maka baginya mendapatkan pahala seperti membebaskan sepuluh orang budak, ditetapkan baginya seratus hasanah (kebaikan) dan dijauhkan darinya seratus keburukan dan baginya ada perlindungan dari (godaan) setan pada hari itu hingga petang dan tidak ada orang yang lebih baik amalnya dari orang yang membaca doa ini kecuali seseorang yang dapat lebih banyak mengamalkan (membaca) dzikir ini.;1;0;1;
Sungguh aku diperlihatkan (dalam mimpi) tentang Lailatul Qadar namun aku lupa atau dilupakan waktunya yang pasti. Namun carilah pada sepuluh malam-malam akhir dan pada malam yang ganjil. Sungguh aku melihat dalam mimpi, bahwa aku sujud diatas tanah dan air (yang becek). Oleh karena itu siapa yang sudah beri'tikaf bersama Rasulullah maka pulanglah. Maka kami pun pulang. Dan tidaklah kami melihat awan yang tipis sekalipun di langit hingga kemudian tiba-tiba datang awan yang banyak, lalu hujan turun hingga air menetes (karena bocor) lewat atap masjid yang terbuat dari dedaunan kurma. Kemudian setelah shalat (Shubuh) selesai aku melihat Rasulullah sujud diatas air dan tanah yang becek hingga aku melihat sisa-sisanya pada dahi Beliau.;1;0;1;
"Tidak ada 'adwa (keyakinan adanya penularan penyakit). Abu Salamah bin Abdurrahman berkata; saya mendengar Abu Hurairah dari Nabi beliau bersabda: Janganlah kalian mencampurkan antara yang sakit dengan yang sehat. Dan dari Az Zuhri dia berkata; telah mengabarkan kepadaku Sinan bin Abu Sinan Ad Du`ali bahwa Abu Hurairah berkata; sesungguhnya Rasulullah bersabda: Tidak ada 'adwa (keyakinan adanya penularan penyakit) maka seorang Arab badui berdiri dan berkata; Lalu bagimana dengan unta yang ada di padang pasir, seakan-akan (bersih) bagaikan gerombolan kijang lalu datang padanya unta berkudis dan bercampur baur dengannya sehingga ia menularinya? Nabi Shallallahu 'alaihi wa Salam bersabda: Lalu siapakah yang menulari yang pertama.";0;1;1;
"Nabi Sulaiman bin Daud 'alaihimas salam berkata; Suatu malam aku akan menggilir (jima') tujuh puluh orang istriku yang setiap istriku itu akan mengandung (dan melahirkan) seorang penunggang kuda yang akan berjihad di jalan Allah. Kemudian temannya berkata kepadanya; Ucapkanlah Insya Allah (Jika Allah menghendaki). Namun Nabi Sulaiman tidak mengucapkan insya Allah sehingga tidak ada satu pun istrinya yang mengandung kecuali satu orang yang kemudian melahirkan anak yang dadanya hilang sebelah (berbadan sebelah). Lalu Nabi Shallallahu 'alaihi wa salam bersabda: Seandainya dia mengucapkan insya-allah pasti anak-anaknya itu akan berjihad di jalan Allah. Syu'aib dan Abu az-Zanad berkata; Yang benar istrinya berjumlah tujuh puluh.";1;0;1;
Demi Allah, kami tidak mempunyai kitab suci yang dibaca selain Kitabullah dan apa yang terdapat dalam lembaran catatan ini. Lantas Ali membukanya, ternyata isinya gigi-gigi unta dan ternyata isinya ada pernyataan, Kota Madinah adalah haram semenjak 'Air (gunung di Madinah) hingga sini, maka barangsiapa melakukan keonaran (pelanggaran) di sana, maka baginya laknat Allah, laknat malaikat dan manusia secara keseluruhan, Allah tidak menerima amalannya, baik yang wajib maupun yang sunnah, dan dalam lembaran catatan itu ada pernyataan 'Barangsiapa bersekutu kepada suatu kaum tanpa seijin sekutu sebelumnya, maka baginya laknat Allah, malaikat dan seluruh manusia, Allah tidak menerima amalannya, baik yang wajib maupun yang sunnah.;0;1;1;
Barangsiapa beriman kepada Allah dan rasul-Nya, mendirikan shalat, dan berpuasa pada bulan Ramadlan, maka Allah berkewajiban memasukkannya kedalam surga, baik ia berhijrah fi sabilillah atau duduk di tempat tinggalnya tempat ia dilahirkannya. Para sahabat berkata, Wahai Rasulullah, tidak sebaiknyakah kami mengabarkan orang-orang tentang hal ini? Nabi malahan menjawab: Dalam surga terdapat seratus derajat yang Allah persiapkan bagi para mujahidin di jalan-Nya, yang jarak antara setiap dua tingkatan bagaikan antara langit dan bumi, maka jika kalian meminta Allah, mintalah surga firdaus, sebab firdaus adalah surga yang paling tengah dan paling tinggi, di atasnya ada singgasana Arrahman, dan daripadanya sungai surga memancar.;1;0;1;
melarang mereka empat hal, dan memerintahkan mereka empat hal. Memerintahkan mereka beriman kepada Allah. Beliau bertanya: Tahukah kalian iman kepada Allah? Mereka menjawab, Allah dan Rasul-Nya lah yang lebih tahu! Beliau menjawab: Yaitu persaksian bahwa tidak ada sesembahan yang hak selain Allah semata yang tiada sekutu bagi-Nya, dan bahwasanya Muhammad adalah utusan Allah, mendirikan shalat, membayar zakat -dan aku taksir dalam perintahnya ada puasa bulan ramadhan-, dan kalian bayarkan seperlima bagian ghanimah. Dan nabi melarang mereka dari duba', hantam, muzaffat, naqir, dan rupanya beliau juga berkata almuqayyar. Nabi meneruskan: Jagalah itu semua, dan sampaikan itu semua kepada orang yang berada di belakang kalian.;1;1;1;
"bahwa Abu Bakar pernah mencium nabi ketika beliau wafat, selanjutnya Aisyah berkata; Kami memasukkan obat melalui mulut beliau ketika beliau sakit, lalu beliau memberi isyarat kepada kami dengan mengatakan: Janganlah kalian memasukkan obat lewat mulutku (dengan paksa). Maka kami berkata; Ah, itu biasa, memang orang sakit tidak suka obat. Ketika beliau tersadar, beliau bersabda: Tidakkah aku telah melarang kalian memasukkan obat kedalam mulutku!, janganlah kalian memasukkan obat ke dalam mulutku. Kami pun berkata; Ah biasa, memang orang sakit tidak suka obat. Lalu beliau bersabda: Tidak ada seorangpun dalam rumah kecuali dirinya harus di obati (dengan paksa) melalui mulutnya kecuali Abbas, karena ia tidak bersama kalian.";0;1;1;
"Kemarilah kalian berbai'at kepadaku, untuk tidak menyekutukan Allah dengan suatu apapun, tidak mencuri, tidak berzina, tidak membunuh anak-anak kalian, tidak berbuat dosa yang didatangkan diantara tangan-tangan dan kaki-kaki kalian, tidak mendurhakaiku dalam perkara yang ma'ruf. Siapa diantara kalian yang menunaikannya maka baginya pahala di sisi Allah, dan siapa yang melanggarnya lalu Allah menghukumnya di dunia ini maka hukuman itu sebagai tebusan, dan siapa yang melanggarnya lalu Allah menutupinya di dunia ini maka perkaranya terserah kepada Allah. Jika Dia menghendaki, akan disiksanya dan jika Dia menghendaki akan diampuinya (di akhirat) . 'Ubadah bin ash Shamit berkata; maka aku membai'at beliau atas hal-hal itu.";1;1;1;
"Merdekakanlah seorang budak. Laki-laki itu berkata; Aku tidak mampu untuk itu. Beliau bersabda: Berpuasalah dua bulan berturut-turut. Ia berkata, Aku tidak sanggup, beliau bersabda: Berilah makan enam puluh orang miskin. Ia berkata, Aku tidak mampu, lalu beliau memberinya keranjang yang berisi kurma. -Ibrahim berkata; Al Araq adalah al Miktal (sebanding antara lima belas hingga dua puluh sha') - Beliau lalu bersabda: Dimanakah laki-laki yang bertanya tadi? Pergi dan bersedekahlah dengan ini. Ia menjawab, Demi Allah, antara dua lembah ini tidak ada keluarga yang lebih membutuhkan ini kecuali kami. Lalu Nabi tersenyum hingga kelihatan gigi gerahamnya, beliau lalu bersabda: Kalau begitu, berilah makan kepada keluargamu.";1;0;1;
Sesungguhnya darah kalian, harta-harta kalian dan kehormatan kalian, haram atas kalian sebagaimana haramnya hari kalian ini di negeri kalian ini dan pada bulan kalian ini. Beliau mengulang kalimatnya ini berulang-ulang lalu setelah itu Beliau mengangkat kepalanya seraya berkata: Ya Allah, apakah aku sudah sampaikan?, Ya Allah, apakah aku sudah sampaikan?. Ibnu 'Abbas Radhiyallahu'anhuma berkata: Maka demi Dzat yang jiwaku berada di tanganNya, sungguh itu suatu wasiat Beliau untuk ummatnya. (Sabda Beliau selanjutnya): Maka hendaklah yang menyaksikan menyampaikannya kepada yang tidak hadir, dan janganlah kalian kembali menjadi kafir sepeninggalku, kalian saling memukul tengkuk kalian satu sama lain (saling membunuh) .;0;1;1;
"Beramalah sesuai sunnah (istiqamah) dan berlaku imbanglah, dan berilah kabar gembira, sesungguhnya seseorang tidak akan masuk surga karena amalannya. Para sahabat bertanya; 'Begitu juga dengan engkau wahai Rasulullah? ' Beliau bersabda: 'Begitu juga denganku, kecuali bila Allah meliputi melimpahkan rahmat dan ampunan-Nya kepadaku.' Perawi berkata; aku kira dari Abu An Nadlr dari Abu Salamah dari Aisyah. 'Affan mengatakan; telah menceritakan kepada kami Wuhaib dari Musa bin 'Uqbah dia berkata; saya mendengar Abu Salamah dari Aisyah dari Nabi dengan redaksi saddidu (beristiqamahlah dalam beramal) wa absyiruu (dan berilah kabar gembira). Mujahid mengatakan mengenai firman Allah Qaulan sadida yaitu berkataan yang benar.";1;0;1;
"Umumkanlah (agar diketahui orang) selama satu tahun. Maka aku lakukan selama setahun namun tidak ada orang yang mengakuinya sebagai pemiliknya. Kemudian aku datangi lagi Beliau dan Beliau berkata: Umumkanlah selama satu tahun. Maka aku lakukan selama setahun lagi namun tidak ada orang yang mengakuinya. Kemudian aku datangi lagi Beliau untuk ketiga kalinya dan Beliau berkata: Peganglah bungkusan dan jumlah isinya, nanti bila ada yang datang sebagai pemiliknya berikanlah namun bila tidak ada yang datang maka nikmatilah. Maka aku nikmati uang itu. (Syu'bah) berkata; Setelah beberapa tahun ketika berada di Makkah aku menemui dia (Salamah), maka dia berkata; Aku tidak tahu apakah selama tiga tahun atau satu tahun saja.";1;0;1;
"Wahai pamanku, ucapkanlah 'Laa Ilaaha Illallah (tidak ada sesembahan yang berhak di sembah selain Allah) ' yang dengannya aku akan berhujah untuk membelamu di sisi Allah -Azza wa Jalla-. Maka Abu Jahal dan Abdullah bin Umayyah berkata kepadanya; Wahai Abu Thalib, Apakah kamu benci dengan agama Abdul Muthalib? Maka Nabi bersabda kepadanya: Sungguh akan aku akan mintakan ampunan untukmu selama aku tidak dilarang. Lalu turunlah ayat, Tidak sepatutnya bagi Nabi dan orang-orang yang beriman memintakan ampun (kepada Allah) bagi orang-orang musyrik walaupun orang-orang musyrik itu adalah kaum kerabat (nya), sesudah jelas bagi mereka, bahwasanya orang-orang musyrik itu adalah penghuni neraka jahanam. (Qs. At Taubah; 113).";0;1;1;
Barangsiapa yang membawa hewan sembelihan hendaklah dia berihram untukhajji sekaligus 'umrah kemudian dia tidak bertahallul hingga bertahallul untuk keduanya (hajji dan 'umrah). Maka aku tiba di Makkah sedang aku dalam keadaan mengalami haidh. Setelah kami selesai melaksanakan manasik hajji, Beliau mengutusku bersama 'Abdurrahman bin Abu Bakar menuju Tan'im. Maka dari tempat itu aku memulai 'umrah. Beliau Shallallahu'alaihiwasallam berkata: Ini pengganti 'umrahmu.Maka orang-orang yang berihram untuk 'umrah melakukan thawaf di Baitullah lalu bertahallul lalu thawaf lagi thawaf yang lain setelah mereka kembali dari Mina. Adapun orang-orang yang menggabungkan hajji dan 'umrah mereka hanya melakukan thawaf satu kali.;1;0;1;
"ada apa dengan kamu? jawabnya; 'Aku menggauli isteriku di bulan ramadhan.' Nabi Shallallahu 'alaihi wa Salam bertanya: Apakah engkau mempunyai seorang budak yang bisa kau bebaskan? 'tidak' jawabnya. Nabi bertanya lagi: Apakah kamu bisa berpuasa selama dua bulan berturut-turut? 'Tidak' Jawabnya. Nabi bertanya lagi: mampukah kamu memberi makan enam puluh orang miskin? 'tidak' jawabnya. Kemudian Nabi Shallallahu 'alaihi wa Salam diberi segantang kurma dan berujar: Ambilah kurma ini dan bersedekah dengannya! ia menjawab; 'Apakah kepada orang yang lebih fakir daripada saya? Sungguh diantara dua gunung ini tidak ada orang yang lebih fakir daripada aku! maka Nabi berujar: Ambillah dan berilah makan keluargamu dengannya!";1;0;1;
Nabi mewajibkan zakat fithri, atau katanya zakat Ramadhan bagi setiap laki-laki maupun perempuan, orang merdeka maupun budak satu sha' dari kurma atau satu sha' dari gandum. Kemudian orang-orang menyamakannya dengan setengah sha' untuk biji gandum. Adalah Ibnu 'Umar radhiyallahu'anhuma bila berzakat dia memberikannya dengan kurma. Kemudian penduduk Madinah kesulitan mendapatkan kurma akhirnya mereka mengeluarkan gandum. Ibnu 'Umar radhiyallahu'anhuma memberikan zakatnya atas nama anak kecil maupun dewasa hingga atas nama bayi sekalipun dan Ibnu 'Umar radhiyallahu'anhuma memberikannya kepada orang-orang yang berhak menerimanya dan dia mengeluarkan zakatnya itu sehari atau dua hari sebelum hari Raya 'Iedul Fithri.;1;0;1;
