hadis;anjuran;larangan;informasi;kitab
"janganlah kalian memujiku berlebihan sebagaimana Isa bin maryam dipuji, katakanlah bahwa aku hanyalah hamba Allah dan rasul-NYA, kemudian sampai berita kepadaku bahwa seseorang diantara kalian berkata; 'Sekiranya Umar telah meninggal maka aku akan berbaiat kepada fulan, janganlah seseorang tertipu dengan yang mengatakan; 'hanyasanya pembaiatan Abu Bakar kebetulan dan sudah selesai, ' ketahuilah, pembaiatan itu memang telah berlalu, namun Allah menjaga keburukannya, ketahuilah bahwa orang yang mempunyai kelebihan diantara kalian, yang tak mungkin terkejar kelebihannya, ia tak akan bisa menyamai kelebihan Abu Bakar, barangsiapa berbaiat kepada seseorang tanpa musyawarah kaum muslimin, berarti ia tidak dianggap dibaiat begitu juga yang membaiatnya, yang demikian karena dikhawatirkan keduanya akan dibunuh. Diantara berita yang beresar di tengah kita adalah, ketika Allah mewafatkan Nabi Shallallahu 'alaihi wa Salam Shallallahu'alaihiwasallam, orang-orang anshar menyelisihi kami dan mereka semua berkumpul di Saqifah bani Sa'idah, dan Ali serta Zubair menyelisihi kami serta siapa saja yang bersama keduanya, dan orang-orang muhajirin berkumpul kepada Abu Bakar, maka aku katakan kepada Abu Bakar; 'Wahai Abu Bakar, mari kita temui kawan-kawan kita dari Anshar, ' maka kami berangkat untuk menemui mereka, tatkala kami telah mendekati mereka, dua orang shalih diantara mereka menemui kami dan mengutarakan kesepakatan orang-orang, keduanya berkata; 'Kalian mau kemana wahai orang-orang muhajirin? ' kami menjawab; 'Kami akan menemui ikhwan-ikhwan kami dari anshar.' Keduanya berkata; 'Jangan, jangan kalian dekati mereka, putuskanlah urusan kalian.' namun aku katakan; 'Demi Allah, kami harus mendatangi mereka', maka kami pun berangkat hingga mendatangi mereka di Saqifah bani Sa'idah, ternyata disana seorang laki-laki yang berselimut kain ditengah-tengah mereka, saya pun bertanya; 'Siapakah ini? ' Mereka menjawab; 'Ini Sa'd bin Ubadah.' Saya bertanya; 'kenapa dengannya? ' Mereka menjawab; 'Dia tengah sakit dan mengalami demam yang serius.' Tatkala kami duduk sebentar, juru pidato mereka bersaksi dan memanjatkan pujian kepada Allah dengan pujian yang semestinya bagi-NYA, kemudian mengatakan; Amma ba'd. Kami adalah penolong-penolong Allah (ansharullah) dan laskar Islam, sedang kalian wahai segenap muhajirin hanyalah sekelompok manusia biasa dan golongan minoritas dari bangsa kalian, namun anehnya tiba-tiba kalian ingin mencongkel wewenang kami dan menyingkirkan kami dari akar-akarnya. Tatkala juru pidato itu diam, aku ingin berbicara dan telah aku perindah sebuah ungkapan kata yang menjadikanku terkagum-kagum dan ingin aku ungkapkan di hadapan Abu Bakar, yang dalam beberapa batasan aku sekedar menyindirnya. Tatkala aku ingin bicara, Abu Bakar menegur; 'Sebentar! ' Maka aku tidak suka jika niatku menjadikannya marah! Maka Abu Bakar berbicara yang dia lembut daripadaku dan lebih bersahaja. Demi Allah, tidaklah dia meninggalkan sebuah kata yang aku kagumi dalam susunan yang kubuat indah selain ia ucapkan dalam pidato dadakannya yang semisalnya atau bahkan lebih baik hingga dia diam. Kemudian dia mengatakan; 'Kebaikan yang kalian sebut-sebutkan memang kalian penyandangnya dan sesungguhnya masalah kekhilafahan ini tidak diperuntukkan selain untuk penduduk quraisy ini yang mereka adalah pertengahan dikalangan bangsa arab yang nasab dan keluarganya, dan aku telah meridhai salah satu dari dua orang ini untuk kalian, maka baiatlah salah seorang diantara keduanya yang kalian kehendaki.' Kemudian Abu Bakar menggandeng tanganku dan tangan Abu Ubaidah bin Al Jarrah, dan dia duduk ditengah-tengah kami. Dan tidak ada yang aku benci dari perkataannya selainnya. Demi Allah, kalaulah saya digiring kemudian leherku dipenggal dan itu tidak mendekatkan diriku kepada dosa, itu lebih aku sukai daripada aku memimpin suatu kaum padahal disana masih ada Abu Bakar ash Shiddiq, Ya Allah, kalaulah bukan karena jiwaku membujukku terhadap sesuatu pada saat kematian yang tidak aku dapatkan sekarang, rupanya ada seorang berujar; 'Aku adalah kepercayaan anshar, berpengalaman, cerdas dan tetua yang dihormati, kami punya amir dan kalian juga punya amir tersendiri, wahai segenap quraisy! ' Spontan kegaduhan terjadi seru, suara sangat membisingkan, hingga aku memisahkan diri dari perselisihan dan kukatakan; Julurkan tanganmu hai Abu Bakar! ' Lantas Abu Bakar menjulurkan tangannya, dan aku berbaiat kepadanya, dan orang-orang muhajirinpun secara bergilir berbaiat, kemudian orang anshar juga berbaiat kepadanya, lantas kami melompat kearah Sa'd bin Ubadah sehingga salah seorang diantara mereka berujar; 'Kalian telah membunuh Sa'd bin Ubadah? ' Kujawab 'Allah yang membunuh Sa'ad bin Ubadah.' Umar melanjutkan; 'Demi Allah, tidaklah kami dapatkan urusan yang kami temui yang jauh lebih kuat daripada pembaiatan Abu Bakar, kami sangat khawatir jika kami tinggalkan suatu kaum sedang mereka belum ada baiat, kemudian mereka membaiat seseorang sepeninggal kami sehingga kami membaiat mereka diatas suatu hal yang tidak kami ridhai, atau kita menyelisihi mereka sehingga terjadi kerusakan, maka barangsiapa yang membaiat seseorang dengan tanpa musyawarah kaum muslimin, janganlah diikuti, begitu juga orang yang di baiatnya, karena dikhawatirkan keduanya terbunuh.'";1;1;1;
Jika hari kiamat tiba, maka manusia satu sama lain saling bertumpukan. Mereka kemudian mendatangi Adam dan berkata, 'Tolonglah kami agar mendapat syafaat Tuhanmu.' Namun Adam hanya menjawab, 'Aku tak berhak untuk itu, namun datangilah Ibrahim sebab dia adalah khalilurrahman (Kekasih Arrahman).' Lantas mereka mendatangi Ibrahim, namun sayang Ibrahim berkata, 'Aku tak berhak untuk itu, coba datangilah Musa, sebab dia adalah nabi yang diajak bicara oleh Allah (kaliimullah).' Mereka pun mendatangi Musa, namun Musa berkata, 'Saya tidak berhak untuk itu, coba mintalah kepada Isa, sebab ia adalah roh Allah dan kalimah-Nya.' Maka mereka pun mendatang Isa. Namun Isa juga berkata, 'Maaf, aku tak berhak untuk itu, namun cobalah kalian temui Muhammad .' Mereka pun mendatangiku sehingga aku pun berkata: Aku kemudian meminta ijin Tuhanku dan aku diijinkan, Allah mengilhamiku dengan puji-pujian yang aku pergunakan untuk memanjatkan pujian terhadap-Nya, yang jika puji-pujian itu menghadiriku sekarang, aku tidak melafadkan puji-pujian itu. Aku lalu tersungkur sujud kepada-Nya, lantas Allah berfirman 'Wahai Muhammad, angkatlah kepalamu, katakanlah engkau akan didengar, mintalah engkau akan diberi, mintalah keringanan engkau akan diberi keringanan.' Maka aku menghiba 'Wahai tuhanku, umatku-umatku.' Allah menjawab, 'Berangkat dan keluarkanlah dari neraka siapa saja yang dalam hatinya masih terdapat sebiji gandum keimanan.' Maka aku mendatangi mereka hingga aku pun memberinya syafaat. Kemudian aku kembali menemui tuhanku dan aku memanjatkan puji-pujian tersebut, kemudian aku tersungkur sujud kepada-Nya, lantas ada suara 'Hai Muhammad, angkatlah kepalamu dan katakanlah engkau akan didengar, dan mintalah engkau akan diberi, dan mintalah syafaat engkau akan diberi syafaat.' Maka aku berkata, 'Umatku, umatku, ' maka Allah berkata, 'Pergi dan keluarkanlah siapa saja yang dalam hatinya masih ada sebiji sawi keimanan, ' maka aku pun pergi dan mengeluarkannya. Kemudian aku kembali memanjatkan puji-pujian itu dan tersungkur sujud kepada-Nya, lantas Allah kembali berkata, 'Hai Muhammad, angkatlah kepalamu, katakanlah engkau akan didengar, mintalah engkau akan diberi, dan mintalah syafaat engkau akan diberi syafaat.' Maka aku berkata, 'Wahai tuhanku, umatku, umatku.' Maka Allah berfirman: 'Berangkat dan keluarkanlah siapa saja yang dalam hatinya masih ada iman meskipun jauh lebih kecil daripada sebiji sawi, ' maka aku pun berangkat dan mengeluarkan mereka dari neraka. Tatkala kami pulang tempat dari Anas, aku katakan kepada sebagian sahabat kami, 'Duhai, sekiranya saja kita melewati Al Hasan -yang dia menyepi di rumah Abu khalifah-'. Lantas kami menceritakan kepada Al Hasan dengan apa yang telah diceritakan Anas bin Malik kepada kami. Selanjutnya kami pun menemuinya dan kami ucapkan salam, ia mengijinkan kami dan kami katakan, 'Wahai Abu Sa'id, kami datang menemuimu setelah kami kembali dari saudaramu, Anas bin Malik. Belum pernah kami lihat sebagaimana yang ia ceritakan kepada kami tentang syafaat.' Lantas ia berkata, 'Heiih.' Maka hadits tersebut kemudian kami ceritakan kepadanya (al Hasan), dan berhenti sampai sini. Namun ia berkata, 'Hei! Hanya sampai situ? ' Kami jawab, 'Dia tidak menambah kami daripada sekedar ini saja.' Lantas ia berkata, 'Sungguh, dia pernah menceritakan kepadaku itu -secara sempurna- kepadaku sejak dua puluh tahun yang lalu, aku tidak tahu apakah dia lupa ataukah tidak suka jika kalian kemudian pasrah.' Kami lalu berkata, 'Wahai Abu Sa'id, tolong ceritakanlah kepada kami! ' Al Hasan kemudian tertawa seraya berkata, 'Sesungguhnya manusia dicipta dalam keadaan tergesa-gesa. Saya tidak menyebutnya selain saya akan menceritakannya kepada kalian. Anas telah menceritakan kepadaku sebagaimana dia ceritakan kepada kalian. Nabi berkata: Kemudian aku kembali untuk keempat kalinya, dan aku memanjatkan dengan puji-pujian itu kemudian aku tersungkur sujud dan diserukan, 'Wahai Muhammad, angkatlah kepalamu, ucapkanlah engkau didengar, mintalah engkau diberi, dan mintalah syafaat engkau akan diberi syafaat, ' maka aku berkata, 'Wahai Tuhanku, ijinkanlah bagiku untuk orang-orang yang mengucapkan La-Ilaaha-Illallah! ' Maka Allah menjawab, 'Demi kemuliaan, keagungan dan kebesaran-Ku, sungguh akan Aku keluarkan siapa saja yang mengucapkan Laa-Ilaaha-Illallah.;1;0;1;
Inilah kewajiban zakat yang telah diwajibkan oleh Rasulullah Shallallahu'alaihiwasallam terhadap kaum Muslimin dan seperti yang diperintahklan oleh Allah dan rasulNya tentangnya, maka barangsiapa dari kaum Muslimin diminta tentang zakat sesuai ketentuan maka berikanlah dan bila diminta melebihi ketentuan maka jangan memberinya, yaitu (dalam ketentuan zakat unta) pada setiap dua puluh empat ekor unta dan yang kurang dari itu zakatnya dengan kambing. Setiap lima ekor unta zakatnya adalah seekor kambing. Bila mencapai dua puluh lima hingga tiga puluh lima ekor unta maka zakatnya satu ekor bintu makhadh betina. Bila mencapai tiga puluh enam hingga empat puluh lima ekor unta maka zakatnya 1 ekor bintu labun betina, jika mencapai empat puluh enam hingga enam puluh ekor unta maka zakatnya satu ekor hiqqah yang sudah siap dibuahi oleh unta pejantan. Jika telah mencapai enam puluh satu hingga tujuh puluh lima ekor unta maka zakatnya satu ekor jadza'ah. Jika telah mencapai tujuh puluh enam hingga sembilan puluh ekor unta maka zakatnya dua ekor bintu labun. Jika telah mencapai sembilan puluh satu hingga seratus dua puluh ekor unta maka zakatnya dua ekor hiqqah yang sudah siap dibuahi unta jantan. Bila sudah lebih dari seratus dua puluh maka ketentuannya adalah pada setiap kelipatan empat puluh ekornya, zakatnya satu ekor bintu labun dan setiap kelipatan lima puluh ekornya zakatnya satu ekor hiqqah. Dan barangsiapa yang tidak memiliki unta kecuali hanya empat ekor saja maka tidak ada kewajiban zakat baginya kecuali bila pemiliknya mau mengeluarkan zakatnya karena hanya pada setiap lima ekor unta baru ada zakatnya yaitu seekor kambing. Dan untuk zakat kambing yang digembalakan di ea ra bukan dipelihara di kandang, ketentuannya adalah bila telah mencapai jumlah empat puluh hingga seratus dua puluh ekor maka zakatnya adalah satu ekor kambing, bila lebih dari seratus dua puluh hingga dua ratus ekor maka zakatnya dua ekor kambing, bila lebih dari dua ratus hingga tiga ratus ekor maka zakatnya tiga ekor kambing, bila lebih dari tiga ratus ekor, maka pada setiap kelipatan seratus ekor zakatnya satu ekor kambing. Dan bila seorang pengembala memiliki kurang satu ekor saja dari empat puluh ekor kambing maka tidak ada kewajiban zakat baginya kecuali bila pemiliknya mau mengeluarkannya. Dan untuk zakat uang perak (dirham) maka ketentuannya seperempat puluh bila (telah mencapai dua ratus dirham) dan bila tidak mencapai jumlah itu namun hanya seratus sembilan puluh maka tidak ada kewajiban zakatnya kecuali bila pemiliknya mau mengeluarkannya.;1;0;1;
"Seandainya kamu diberi umur panjang, kamu pasti akan melihat seorang wanita yang mengendarai kendaraan berjalan dari Al Hirah hingga melakukan thawaf di Ka'bah tanpa takut kepada siapapun kecuali kepada Allah. Aku berkata dalam hati; Dimana para parampok suku Tha'iy yang telah mengobarkan api fitnah di seluruh pelosok negeri?. (Beliau melanjutkan): Seandainya kamu diberi umur panjang, kamu pasti akan menaklukan perbendaharaan Kisra (Raja Persia). Aku bertanya; Kisra bin Hurmuz?. Beliau menjawab: Ya, Kisra bin Hurmuz. Dan seandainya kamu berumur panjang, kamu pasti akan melihat seseorang keluar dengan membawa emas atau perak sepenuh telapak tangannya mencari orang yang mau menerima (shadaqah) nya namun dia tidak mendapatkan seorangpun yang mau menerimanya. Dan pasti setiap orang dari kalian akan berjumpa dengan Allah pada hari perjumpaan dengan-Nya (qiyamat) yang ketika itu antara dirinya dan Allah tidak ada penerjemah yang akan menjadi juru bicara baginya. Lalu Allah pasti akan bertanya kepadanya: Bukankah aku sudah memberimu harta dan memberimu karunia?. Orang itu menjawab; Benar. Lalu orang itu melihat ke kanannya namun dia tidak melihat apa-apa melainkan neraka Jahannam, lalu dia melihat ke sebelah kirinya namun dia tidak melihat apa-apa melainkan neraka Jahannam. 'Adiy berkata; aku juga mendengar Nabi Shallallahu 'alaihi wa salam bersabda: Jagalah diri kalian dari neraka sekalipun dengan (bershadaqah) setengah biji kurma. Jika tidak memilikinya maka dengan berkata yang baik. Adiy berkata; Lalu di kemudian hari aku melihat seorang wanita mengendarai kendaraan berjalan dari Al Hirah hingga melakukan thawaf di Ka'bah tanpa takut kecuali kepada Allah dan aku termasuk orang yang menaklukan perbendaharaan Kisra bin Hurmuz. Dan seandainya kalian diberi umur panjang, kalian pasti melihat apa yang disabdakan Abu Al Qasim, Nabi Shallallahu 'alaihi wa salam yaitu seseorang keluar dengan membawa harta sepenuh telapak tangannya. Telah bercerita kepadaku Abdullah bin Muhammad telah bercerita kepada kami Abu 'Ashim telah mengabarkan kepada kami Sa'd bin Bisyir telah bercerita kepada kami Abu Mujahid telah bercerita kepada kami Muhillu bin Khalifah aku mendengar 'Adiy; Aku bersama Nabi Shallallahu 'alaihi wa salam.... (Keterangan Al Hirah adalah negeri atau wilayah kekuasaan raja-raja Arab jahiliyah. Letaknya 3 mil dari kota Kufah (Iraq). Sekarang tempat itu sudah hilang).";1;0;1;
Pernah terjadi gerhana matahari di masa Rasulullah . Maka Rasulullah melaksanakan shalat bersama kaum muslimin. Beliau berdiri dengan berdiri yang sangat panjang sebagaimana panjangnya bacaan surat Al Baqarah. Kemudian beliau ruku' dengan ruku' yang panjang pula. Sesudah itu beliau bangkit dari ruku' lalu berdiri lagi dengan sangat panjang namun tidak sebagaimana panjangnya berdiri beliau yang pertama. Kemudian beliau ruku' dengan panjang, namun tidak sepanjang ruku'nya yang pertama. Lalu beliau teruskan dengan sujud. Setelah itu, beliau bangkit kembali dan berdiri dengan panjang, namun tidak sepanjang berdirinya pertama kali. Kemudian ruku' dengan panjang, tetapi tidak sebagaimana ruku'nya yang pertama. Kemudian beliau bangkit lagi dan berdiri dengan lama, namun tidak selama berdirinya yang pertama. Lalu beliau ruku' kembali dengan lama, tetapi tidak seperti ruku'nya yang pertama. Kemudian beliau bangkit lalu sujud. Setelah beliau selesai shalat matahari pun kembali menampakkan cahaya. Maka beliau pun bersabda: Sesungguhnya matahari dan bulan adalah dua tanda dari tanda-tanda Allah, tidaklah terjadi gerhana pada keduanya karena kematian seseorang atau pun karena kehidupannya. Jika kalian melihat hal itu, maka berdzikirlah kepada Allah. Para sahabat berkata, Wahai Rasulullah, kamu melihat bahwa Anda sepertinya mendapatkan sesuatu di tempat Anda berdiri, lalu kami melihat bahwa Anda tertahan. Maka beliau pun bersabda: Sesungguhnya aku melihat surga -atau- surga telah diperlihatkan padaku, lalu aku pun hendak mengambil seranting darinya, sekiranya kau dapat mengambilnya niscaya kalian akan memakannya selama dunia masih ada. Kemudian aku melihat neraka, maka aku tidak pernah melihat pemandangan seperti yang terjadi pada hari ini. Aku melihat kebanyakan penghuninya adalah wanita. Mereka bertanya lagi, Kenapa wahai Rasulullah. Beliau menjawab: Karena kekufuran mereka. Para sahabat bertanya lagi, Apakah lantaran kekafiran mereka kepada Allah? beliau menjawab: Mereka mengkufuri perlakuan dan kebaikan suaminya. Sekiranya kamu berbuat baik kepada salah seorang dari mereka selama setahun penuh, lalu ia melihat sesuatu yang tidak baik darimu, ia pun akan berkata, 'Aku tidak melihat kebaikan sedikit pun darimu.';1;0;1;
"Sesungguhnya zaman itu terus berputar sama seperti saat Allah menciptakan langit dan bumi, setahun ada dua belas bulan, dan empat di antaranya adalah bulan-bulan haram, dan tiga di antaranya adalah bulan-bulan yang berurutan yaitu; Dzul Qa'dah, Dzul Hijjah, Muharram dan Rajab. Sedangkan bulan Rajab adalah bulan Mudzar yaitu bulan yang terletak antara Jumadil Akhir dan Sya'ban. (beliau bertanya): Bulan apakah sekarang ini? kami menjawab; Allah dan Rasul-Nya yang lebih mengetahui. Beliau terdiam beberapa saat, hingga kami menduga bahwa beliau akan menyebutnya dengan nama yang lain, lalu beliau bersabda: Bukankah sekarang bulan Dzul Hijjah? kami menjawab; Benar. Beliau bertanya lagi: Negeri apakah ini? kami menjawab; Allah dan Rasul-Nya yang lebih mengetahui. Beliau terdiam beberapa saat, hingga kami menduga beliau akan menyebutnya dengan nama yang lain, lalu beliau bersabda: Bukankah sekarang kita berada di negeri Baldah? kami menjawab; Benar. Beliau kembali bertanya: Hari apakah ini? kami menjawab; Allah dan Rasul-Nya yang lebih mengetahui. Beliau terdiam beberapa saat, hingga kami mengira beliau akan menyebutnya dengan nama yang lain. Kemudian beliau bersabda: Bukankah sekarang adalah hari Nahr (kurban)? kami menjawab; Benar. Beliau kemudian bersabda: Sesungguhnya darah kalian, harta bendamu -Muhammad berkata; saya kira beliau juga bersabda: dan kehormatan kalian- adalah haram atas diri kalian, seperti haramnya harimu sekarang ini, di negerimu ini, dan di bulan kalian ini. Sesungguhnya kalian pasti akan bertemu dengan Rabb kalian (di hari kiamat kelak), dan Dia akan menanyakan tentang semua amal perbuatan kalian. Oleh karena itu, sepeninggalku nanti, janganlah kalian kembali kepada kesesatan -dimana sebagian dari kalian membunuh sebagian yang lain-, hendaknya orang yang hadir pada saat ini menyampaikan kepada orang yang tidak hadir! bisa jadi orang yang mendengar dari mulut kedua justru lebih menjaga apa-apa yang di dengarnya daripada orang yang mendengarnya secara langsung. Sedangkan apabila Muhammad menyebutkan hadits tersebut, dia berkata; Nabi benar. Setelah itu beliau bersabda: Bukankah aku telah menyampaikannya, bukankah aku telah menyampaikannya?! Hingga dua kali.";1;0;1;
"Yang menghalangiku adalah karena Allah telah mengharamkan darah saudara muslim. Lalu keduanya berkata; 'Bukankah Allah telah berfirman: Dan perangilah mereka sehingga tidak ada lagi fitnah? maka Ibnu Umar menjawab: Kami telah berperang hingga fitnah itu tidak ada lagi dan din ini sudah menjadi milik Allah. Sedangkan kalian menginginkan peperangan hingga terjadi fitnah dan din ini menjadi milik bukan selain Allah. 'Utsman bin Shalih menambahkan dari Ibnu Wahhab dia berkata; Telah mengabarkan kepadaku Fulaan dan Haiwah bin Syuraih dari Bakar bin 'Amru Al Ma'afiri bahwa Bukair bin 'Abdullah Telah menceritakan kepadanya dari Nafi' bahwa seseorang menemui Ibnu 'Umar seraya berkata; 'Wahai Abu 'Abdur Rahman apa yang menghalangimu untuk berhaji dan berumrah pada tahun ini dan kamu meninggalkan jihad di jalan Allah padahal kamu tahu bahwa Allah sangat menganjurkan hal itu? Ibnu Umar menjawab; 'Wahai anak saudaraku, Islam ini dibangun atas lima dasar; Iman kepada Allah dan Rasul-Nya, shalat lima waktu, puasa dibulan Ramadlan, menunaikan zakat, dan haji ke baitullah. Laki-laki itu berkata; 'Wahai Abu Abdurrahman, apakah kamu tidak mendengar apa yang disebutkan Allah di dalam kitabnya: Dan kalau ada dua golongan dari mereka yang beriman itu berperang hendaklah kamu damaikan antara keduanya! Tapi kalau yang satu melanggar perjanjian terhadap yang lain, hendaklah yang melanggar perjanjian itu kamu perangi sampai kembali pada perintah Allah. Juga firman Allah: Perangilah mereka hingga tidak ada fitnah. Ibnu Umar menjawab; 'kami telah melakukan hal itu pada masa Rasulullah ketika Islam masih sedikit hingga seseorang dari kami difitnah karena agamanya, baik dengan dibunuh maupun disiksa sampai Islam semakin menyebar dan tidak ada lagi fitnah. Orang itu berkata lagi; 'Bagaimana pendapatmu tentang Utsman dan Ali? Ibnu Umar menjawab; 'Adapun Utsman maka Allah telah memaafkannya sedangkan kalian telah membenci untuk memaafkannya. Sedangkan Ali dia adalah sepupu Rasulullah dan menantunya. Lalu dia mengisyaratkan dengan tangannya seraya berkata; 'Inilah rumahnya sebagaimana kamu lihat.'";1;0;1;
"Umar mendatangiku dan berkata, 'Mayoritas korban perang Yamamah adalah para penghafal Al Qur`an. Dengan gugurnya mayoritas penghafal Al Qur`an, maka aku khawatir sebagian besar Al Qur`an juga akan hilang. Maka aku berpendapat, sebaiknya Anda segera memerintahkan guna melakukan dokumentasi alquran.' Maka aku pun bertanya kepada Umar, 'Bagaimana kamu akan melakukan sesuatu yang belum pernah dilakukan oleh Rasulullah ? ' Umar menjawab, 'Perkara ini, demi Allah adalah ide yang baik.' Umar selalu membujukku hingga Allah memberikan kelapangan dadaku, dan akhirnya aku sependapat dengan Umar. Zaid berkata; Abu Bakar berkata, Sesungguhnya kamu adalah seorang pemuda yang cerdas, kami sama sekali tidak curiga sedikit pun padamu. Dan sungguh, kamulah yang telah menulis wahyu untuk Rasulullah . Karena itu, telusurilah Al Qur`an dan kumpulkanlah. Zaid berkata, Demi Allah, sekiranya mereka memerintahkanku untuk memindahkan gunung, niscaya hal itu tidaklah lebih berat daripada apa yang mereka perintahkan padaku, yakni dokumentasi alquran. Zaid bertanya, Bagaimana kalian melakukan sesuatu yang belum pernah dilakukan oleh Rasulullah ? Ia menjawab, Demi Allah, itu adalah kebaikan. Abu Bakar terus membujukku, hinnga Allah pun memberikan kelapangan dadaku, sebagaimana Abu Bakar dan Umar . Maka aku pun mulai menelusuri Al Qur`an, mengumpulkannya dari tulang-tulang, kulit-kulit dan dari hafalan para Qari`. Dan akhirnya aku pun mendapatkan bagian akhir dari surat At Taubah bersama Abu Khuzaimah Al Anshari, yang aku tidak mendapatkannya pada seorang pun selainnya. Yakni ayat: 'Sungguh, telah datang pada kalian seorang Rasul dari kaum kalian sendiri, yang sangat berat olehnya kesulitan yang menimpa kalian..' hingga akhir surat Al Bara`ah. Lembaran-lembaran Al Qur`an itu pun tetap tersimpan pada Abu Bakar hingga Allah mewafatkannya. Kemudian beralih kepada Umar semasa hidupnya, lalu berpindah lagi ke tangan Hafshah binti Umar .";1;0;1;
"Aku ditolong dengan perantaraan angin yang berhembus dari timur (belakang pintu Ka'bah) sedangkan kaum 'Aad dibinasakan dengan angin yang berhembus dari barat. Perawi berkata; Dan Ibnu Katsir berkata dari Sufyan dari bapaknya dari Ibnu Abi Nu'im dari Abu Sa'id Radhiyallahu'anhu berkata; 'Ali mengirim perhiasan emas kepada Nabi Shallallahu 'alaihi wa salam lalu Beliau membagikannya kepada empat orang, yaitu kepada al-Aqra' bin Habis al-Hanzhaliy, yang kemudian sebutannya menjadi al-Mujasyi'iy, 'Uyaynah bin Badr al-Fazariy, Zaid ath-Tha'iy kemudian dia menjadi salah seorang suku Bani Nabhan dan 'Alqamah bin 'Ulatsah yang kemudian menjadi salah seorang suku Bani Kilab. Orang-orang Qurais dan Kaum Anshar menjadi marah. Mereka berkata; Beliau telah memberi para pahlawan penduduk Nejed dan malah mengabaikan kita. Beliau berkata: Aku memberi mereka dengan tujuan agar menjinakkan hati mereka (ke dalam Islam). Lalu datanglah seseorang yang kedua matanya menjorok ke dalam, wajahnya kusut dengan jenggotnya dicukur seraya berkata: Bertaqwalah kamu kepada Allah, wahai Muhammad. Maka Beliau berkata: Siapakah yang dapat bertaqwa kepada Allah seandainya aku saja mendurhakai-Nya. Apakah patut Allah memberi kepercayaan kepadaku untuk penduduk bumi sementara kalian tidak mempercayai aku?. Kemudian ada seseorang, aku kira dia adalah Khalid bin al-Walid, yang meminta idzin untuk membunuh orang itu namun Beliau melarangnya. Setelah orang itu pergi, Beliau bersabda: Sesungguhnya dari asal orang ini atau di belakang orang ini (keturunan) akan ada satu kaum yang mereka membaca al-Qur'an namun tidak sampai ke tenggorokan mereka. Mereka keluar dari agama bagaikan keluarnya anak panah dari busurnya dan mereka membunuh pemeluk Islam dan membiarkan para penyembah berhala. Seandainya aku bertemu dengan mereka pasti aku akan bunuh mereka sebagaimana kaum Ad dibantai.";1;0;1;
